Sentimen,Comment
0," <USERNAME> itu yg komen via nyinyir mulu duh kyak dia gak pernah nyinyirin orang aja, mungkin lebih parah, kalo org sudah sok bener mah gitu, pdhal ini kan media sosial, hak dia dong instagram juga instagram dia, yg penting kan nyinyir gak pake ig s"
0," <USERNAME> ini lagi pemikiran manusia bodoh, eehhh tante/ibu/oma/empo, otak lu picik bngt ya, dia jga manusi biasa ada larangan emang di dunia ini orang di larang ngungkapin unek2???? stupid human"
0, <USERNAME> bisa nya cuma ngatain org . Nyindir siapa ..netijen goblog banyakan masyako !
0," <USERNAME> cara didik ortunya nagita bagus, makanya amat sangat heran dg balajaer, kan nagita yah yg dirugikan sm junjunganny.. Knp dia yg dibenci, bodoh bgt asli."
0," <USERNAME> pdhl km lebih kampungan loh,pake kerudung tapi mulutnya cuihh.."
0,Belajaer tuh apa ya? Hahahaha bela artis ampe sebegitunya... manusah2 begoh ????????
0," <USERNAME> iya banyak berarti mereka norak kampyuung, coba liat artis yang adem ayem liat isyana liat agnezmo liat mba liaaat..... jangan diliat aja coba di telaah deh, dikasih tau contoh artis yang better eh jawabannya begini ya cocok la"
0," <USERNAME> gak usah sok jadi high class mba, liat komenmu sendiri, memang semua artis itu sama, beda2 mbak, ada yg suka curhat di ig, ada yg curhat ke temen ada yg curhat ke Tuhan.... ngak usah trus mulut situ maju dulu otaknya belakangan mikirnya, yg curh"
0," <USERNAME> lah goblok amat, gak semua netizen yg kontra sm postingan si via ini bakajaer kali, mba/mas. Ih goblok kok dipiara. Lol"
0,Ini siapa sih emg artis? Ko artis indo bukan ny ngurus prestasi malah di sosmed ny beginian mulu isi nya jd jatoh nya kampungan
0," <USERNAME> baru itu aj kn y mba, apa lagi kaya agnes mo bnyk penghargaan ny tp g kampungan beda am yg ini"
0,Munafik bgt yg ngomong curhat di sosmed kampungan... Gua yakin elu juga kitu keleusss wkkwkww..... Mending mba via dia artis cantik bs nyanyi.. La elu pada? Lbh kampungan wkwkwkwkw!!!!
0, <USERNAME>.wawan zzzzz emng ini artis ga punya tmn apa? Dikit dikit att hahaha lagi juga apa apa curhat di sosmed kampungan
0,Lemes ya mulutnya. Berani lewat ststus udah gitu tulisannya sengaja biar ga kebaca takut kali di labrak. Mmmm artis masih kampungan sih ya jadi wajar lah ya ????????
0, <USERNAME> main main lah ke jawa timur.. Biar ga begok!!
0, <USERNAME> bisa nya cuma ngatain org . Nyindir siapa ..netijen goblog banyakan masyako !
0," <USERNAME> dia udah nunjukin karyanya, situ pny karya apa? Karya nyinyir hidupnya Via?? Tolol ??"
0," <USERNAME> siapa bilang gw fansnya Via?? Duh nantangin gw nih org... anak tolol ank alay, jablay!"
0, <USERNAME> yutub apaan ya mba? Aplikasi baru ya? Sy taunya youtube. Mba gak tau apa ya seseorg bs dpt penghasilan besar salah satunya dr youtube loh. Mreka jg di bayar apalagi klo bnyk yg ntn video mreka. Sekolah yg bener deh mba biar pinter. Generasi muda
0,"gue suka gangerti deh yaa, kenapa kalo via vallen bikin status atau apalah itu disangkut pautin ama att mulu?? padahal att nya aja biasa aja.. Fansnya sih yg bikin jelek.. Orang kalo di sangkut pautin mulu jg lama-lama gerah kali.."
0,Jujur aja ya ni org malah bagusan kaga oplas..ada tu foto dia sblm dn sesudah oplas..dioplas mukanya aneh...kyknya gagal oplasnya...
0,Noraaak abiiis... Baru kebeli emas az pamer aplg mainan berlian ciiinnnnn.... ??
0,Before and after pasca oplas ga ngefek ya.. tetep jelek n serem mukanya..ahahahhaha..
0,"Salfok ke mukanya, sumpah jelek... Oplas apaan model begitu... Failed!!!"
0,Norak bener. Kegaet penjahat baru rasa.
0,"Najis..,apalagi d philipine biasa bgt kali,d sana aj bangga..jd perusak moral ko bangga..najis banget liatnya.ckp d sini aj komen ny,dia pngn ngetop lwt nitezerrre.....wkwkwk..ngarep laku"
0,Yang gua bingung jujur kenapa media pada rebutan ngeliput ini orang. Kayaknya cuman net doang media informasi yang masih waras
0,"Bukankah Jedun yg ga becus jadi perempuan terhormat, ga becus jadi perempuan cerdas, ga becus jadi perempuan yg mencari suami sah bukan suami orang, ga becus jadi perempuan yg menghindari narkoba, ga becus jadi perempuan yg menjaga nama baik keluarga... semoga hanya ada satu perempuan yg kayak kamu di dunia ini ya Jedun"
0,"cewe yg bgni yg hrsnya gosong jd abu aja di kebakaran pabrik yg lg viral kmrn tu. bnr2 slain ga brguna, gda otak.. cm modal ngangkang trs gebet laki org trs bangga.. btw klo emg instastory nya buat nyindir sesebini tua mah. ehhh at least biar ga becus jd prewi tp becus cuii jd emak. buktinya anak nya bejibun trs smua pro ke emaknya drpd bapaknya"
0,"Hahaha..kasian ya...gak becus jadi perem...harus ngerebut laki orang dulu biar dikata ""perempuan""? Dasar perempuan tak sadar diri ente cuy."
0,Dasar artis abal abal enggk laku di layar kaca...udh Enggk ada duit kere Miskin..Jadi maen k dukun buat minta elmu pelet perebut suami org yg kaya...
0,"ih dia kan paling becus makrum, paling becus ngrebut suami orang hehe????"
0,Eeee si pelacur. Situ becus jd brempuan emang? Becus jadi sampah sih iya. Edeuuuuuh lonte lonte
0,"Biarin,,,puas puasin mumpung deseu masih brasa muda. Ntar klo dah tua juga nyaho! Karma itu ada."
0,Dia ini punya anak perempuan lho. Ibu macam apa contohin jelek ke anaknya. Jauh dari kata BECUS ini perempuan. Amit amit...
0,Kaya becus aja jd permpuan dia yng g becus jd perempuan ko sukanya sm laki orng heheh
0,Yg gk becus tuh loh jedun...hidup nya cuma bisanya ngerusak kbhgiaan org lain .mau hidup serba mewah tp g mau krja mlh morotin laki org..karma psti akn mnghampirimu????????
0,Gue gak suka sm ni orang. Idupnya kebanyakan ribut.
0,Dasar artis abal abal enggk laku di layar kaca...udh Enggk ada duit kere Miskin..Jadi maen k dukun buat minta elmu pelet perebut suami org yg kaya...
0,"Yg nama ny plagiat ya plagiat, walaupun laku tp tetep ajah ciptaan dri hasil plagiat..wkwkwkwk gua mah ogah dwngerin ajah udh pngen muntah"
0,"Dasar plagiat semuanya, ga bisa kreatip.memalukab bgt"
0,"Dan dengan begonya dia bilang ""apanya yang sama yaaa liriknya aja tentang percintaan gitu kok lagu saya"" bener2 tolol si ayu. Gapunya kuping apa y orang yg dipermasalahin nadanya ????????"
0,Itu pacarnya anggel pietrs kali.... dan cowok itu juga masih bocah....  <USERNAME> yaelah jes.. terxta kelakuan mu sama aja sprti ayuting2 Hidupmu penuh dengan drama MURAHAN
0,"japok gateeel emang,uda jelas dia ada main sama si mamad,sampe"" si jessica dimusuhin,deddy corbuzier aja jijik sama si japok semenjak nagita diundang di hitam putih berarti nagita cerita di belakang panggung,itu aja sih menurut gue"
0, <USERNAME> lebih memalukan anda buk ...ngomong pelakor emang ibuk udah pernah jadi pelakor ya kok bisa tau ayu pelakor wkwkwkwkwk. ..awas ibu nanti malah justru rumah tangga ibu yg dimasukin pelakor atau anaknya nanti jadi pelakor ..
0,Wah itu Kerdus mulutnya busuk...jangan jangan sampah makanannya
0, <USERNAME> TAI loe di gedein bagus buat pupuk jngan bacot loe goblok !!! nih cewek knpa bawa2 suku ?
0,LAH ELO ARTIS APAAN? PAPAN BLENYEK AJA BELAGU AMAT ARTIS APAAN KGA POPULER SAMA SEKALU HAHAHA
0,ANANG MUKA NYA KAYA BABIII GITU AJA DI DEMENIN JIJIKK
0,"Kalau ga suka sama ayu ting ting ga usah separah itu dong ngejudge nya. Punya HATI dan OTAK kan? Dia juga manusia punya kekurangan dan juga punya kelebihan dan dia juga punya perasaan. Jadi jangan seenak nya menjudge orang seperti itu, kaya udah SEMPURNA AJA LO!  <USERNAME>"
0,"Ga pantes dipanggil ustad..org munafik ceramah sana sini org kelakuan sndr aja menzolimi istri sah nya dgn poligami diam2.kacian istri pertamanya,ga tw malu istri keduanya.. hadeh klo ada yg msh manggil dia bwt ceramah namanya bodo.."
0,Biadab!! Klo nanti anak lo di bully.. Gue mampusin ya!!!
0,"Dasar ANJING tuh cowok bukan org, berani sama cowok biasa one by one jangan sama yg lemah, dasar yah cowok2 jaman skrg, casing doank cowok, nyali nya lebih2 dari banci"
0," <USERNAME> iya kasian si micin?? padahal perusahan produk micin mengiklan kan kalo masak ""tambahkan micin biar tambah sedap"" netizen menyudutkan mecin seolah semua kebodohan orang yg punya gangguan jiwa ngemil micin??#justiceformicin"
0,Wahh jngn2 ini Vidio lama...kok bajunya norak bngtt seorang ayuu...terlihat murahaan
0, <USERNAME> bego lo ya
0,Editan banget itu. Ya ampun si mommy lambe kehabisan gosib ya buat si pelakor ?????????
0,yah admin nya termasuk golongan pengonsumsi mecin dan pil pcc.. otak lu rusak min?
0,cuma org govlok yg prcya ayu slgkuh sma rafi.buktinya rafi sma gigi skrg baek2 aja..dan ktamu ayu itu pelakor?? SUAMI Siapa yg d rebut woyy?? skrg ayu punya suami?? fikir pke otak mkanya jgn kbanyakan micin kan jdi govlok
0, <USERNAME> hoy barisan sakit hati ?? jijikk banget.. fans billy mah ALHAMDULILLAH bgt billy putus sama manusiaa buluk ituu... itu yg ditunggu lama2 akhiry putus juga.. dan sekarang kobil jg jijik sama ni orang :v
0,"MBA  <USERNAME> KALAU KAMU GAK NGERASA CINLOK SAMA BABANG ANTHONY TERUS KALIAN AWALNYA KETEMU DIMANA SIH? DI SINET BOY KAN? ALAH NGAKU AJAAA. BERARTI KAN MBA DUMANG CINLOK, JANGAN SOK2 BILANG GAK CINLOK ITU NAMANYA PEMBODOHAN . WAJAR DONG NETIZEN BILANG RATU CINLOK KENYATAAN EMANG YA KAN? JANGAN MARAH .... RESIKO JADI ARTIS HAHAHHAA PINTER2 YA MBA KALAU MAU CARI ALASAN HAHAHAHAHA"
0," <USERNAME> Noh urus tu kuin lu, biar ga gatel nempel2 ama laki orng, masyarakat udh tau kali japok gundik janda gatel,udh kenyataan nya begtu KATANYA ANAK SHOLEHAH AGAMA NYA KUAT TAPI MATA KULIAH AGAMA CMA DPT 1,KATANYA AGAMA NYA KUAT TPI HAMIL DI LUAR"
0," <USERNAME> bilang tu sama kuin lu, jangan gesek grepe ama lakik orng, ga malu apa udh hamil di luar nikah, kegatelan amat jadi janda"
0," <USERNAME> please lo jangan bela pelakor,ini semua hukuman untuk si muljem karna uda tega recut suami sahabat sendiri,dia lagi menjalani sanksi sosialnya!! kenapa valakor mesti dibenci?? karna biar ga ada valakor"" lainnya di Indonesia,biar musnah sem"
0,"NAJIS. INI BARU MUAKK, MENJIJIKAN, PELAKOR. JIJIK"
0,Semoga pelakor2 kena karma dan semoga dapat karma yg meninggalkan istrinya yg bwrjuang dg dia dr nol tp setelah sukses selingkuh dan sok jd penguasa ke istri ya..
0,Sedih ya skrg ngamen di kawinan org .. mantan istri mahhhh naik pesawat jet .. bhay pelakor n botakbego ??????
0, <USERNAME> heeehh lo pelakornya yaaaakkk??? Ngapa lo jadi emosi??? Situuu kenal gw??? Kalo berani pake akun asli dong. Pantes pake akun bodong! Ngerebut laki orang juga diem2. ?????????? keceplosan yak pake aku bodong. Ngakak gueeee ?????????? lucu lo!
0,Wkwkwkwk udh gak laku lagi jd nyanyi dhajatan si lonte pelakor
0," <USERNAME> wakakak banyak lah cerita kyk gituu, buat pembelajaran aja.. jgn sampe ni swamik swamik lebih milih ke pelakor drpd istri pertama. Bakalan hancuuurr bookk ga bohong deh. Bakalan kere bakalan kismin bakalan nyungsep. Emang yg ngatur rezeki tu tuha"
0,Ini cwenya yg bego apa cwonya yg pinter ya ?! Emg lakinya kaya ?! Atau macho atau apa gitu plus nya ? Kayanya cuma jago gombal ?? atau maennya gesit ?! Ulala #ngakakabis
0, <USERNAME> kamu itu yg bodoh! Ngapain keluarga depok komen org yg gak ada artinya lagi buat mereka??. ..cuma kalian aja yg hidupnya gak bahagia yg suka menghujat orang dan hidup artis ayu terlalu berpengaruh buat kamu!!. Emang dasar kamu benci ayu..klo
0, <USERNAME> saya mah lihat yg terlihat jelas.. bukan main prasangka kayak elu.elu itu haters kayak dukun...dukun titisan dajjal .. sok Pinter tapi otak kosong?????? sorry ye.. gue bala Nabi Muhammad yg percaya klo udh ditunjukkin 4 saksi Dan bukti.. klo
0,Mata ku sepet baca koment fans ubul empang ..minggir woy bikin rusuh aja nih jaer amis jijik sumpah.soal enji sm cewek lain ttp aja bala jaer nyampah bikin ribut .
0,"Ini siapa sih si enji, hartis kah ? Males banget jijik laki model beginian mah gak ada tanggung jwbnya. Ayu bunting di tinggalin anak gak di akuin, skrg anak udh nongol bilqis cantek eh sampek bini nya ngeposting yg seolah enji kangen anaknya. Najonggg jijik betoll.. Dah deh min gak usah di bahas lagi laki macam begini, hartis aja bukan gak ada panutan yg bisa di ambil  <USERNAME>"
0," <USERNAME> bego nya lagi pede amat ngomong seolah yg dia bilang paling bener, padahal bukti aja kaga ada. Mau keliatan pinter jatohnya bego??"
0,Yang pada bilang enji ganteng bebas slingkuh bego kali. Ganteng pala lu bau menyan. Gada ganteng ganteng nya. Kebanyakan gaya kek mantan bini depok nya.
0,"Sebenarnye cocok enji sama att, sama sama GATEEEEL hahah pantesan si tongtong dipertemukan dgn enji, udh hukum alam klw jodoh kita cerminan diri kita, nah si entong hrsnya bekaca dgn masa lalu biar sadar tp teryata otak 1 M tetep mau di pertahankan jd skrg mlh menjadi jadi guatelnye, sama aja kek enji, hah"
0," <USERNAME> oalaahhh,, semakin banyak aja pelakor ?? laki nya jg kegatelan, tp namanya laki ibarat kucing di ksh ikan jaer gratis ya kga nolak wkwkkwkw"
0,"Begitulah laki2 ya sis, lebih suka pecun2 murahan, daripada prempuan baik2 berjilbab ato pintar. Enji2, kok downgrade sih? Dari pedangdut naik kelas prempuan berjilbab ehh milih sama pecun lagi.. jeleknya seleramu"
0,Motorninja aj songong amat mba org yg punya mobil lamborgini aj biasa wae kok ????????
0,GoBlOk ?????? gua nonton berkali≤ kaget juga ??
0,"Ga usa pake anjing, babi!! ?????? kalo gw bls gitu wkwk"
0,Oh ini toh yang kemaren TIDAK MENGHARGAI KARYA ORANG DAN SEENAKNYA BILANG JELEK BANGET... Aduh itu penganten perempuan nya KEKENYANGAN yah... Ampe kembung gitu perut nya... #pepuraLuGU
0,"Dari awal percaya gimik Raffi gigi dn att...sehingga att peserta keluarga di hujad dn anak ny...di hujad ...semakin kesini penonton semakin di bodohin?? semakin publik tertuju mereka ??????yg kasihan para penghujad ....ga apa"" lah ayu ga ada di pesbukers biar dia ngeluarkn album"" baru single baru setelah para artis halan"" keluar nengri gimik"" apa lagi yoo"
0,"Kalo bener gimmick, bodoh banget si ayu cuma demi rating n popularitas berani taruhin harga dirinya buat di nilai buruk oleh mata masyarakat ????"
0,Susah otaknya diemvang mah bikin rusuh dilapak orang
0,najiiisss kayak si mba dese ga gitu ajaaa. hahahahaha maling teriak maling. ngaca buuuuuk
0, <USERNAME> IYAK KAA HAHAHAHAH geli bgt gasih sama att ih kampung abis:(((
0,"JOGETNYA BIKIN NGAKAKKK ANJIRRRR, KAMPUNGAN BANGET??????  <USERNAME>  <USERNAME>"
0,Bagus la gue berarti ada otak gak kayak lu malu maluin mak lu aja tong akun asli di pake tu yg namanya bego!  <USERNAME>
0,"Yg bego mah elu, ibu mana sih yg mau ngasih contoh buruk ke anaknya , pake mata lo, emg ada di dugem bawa anak , bego sih -_- jaman udah texas , dan gue jamin dijaman anaknya jga pasti udh lebih texas . Selagi ga ngerugiin lo yaudah . Sewot banget ."
0,"Si wanita jahiliyah.. Lesbi , skrg udh py pacar lg. Kasian anaknya. Kmrn di ksh bencana slnya dia tega misahin anak dr bapak nya, dia ktakutan anak nya masuk islam pdhl bp nya g prnh nuntut anaknya memeluk islam. Udh di ksh nikmat anak 3 org, msh aja begajulan."
0, <USERNAME> gw tanya. Emang kador artis beneran? Komen lo tolol sumpah. Masa harus kenal dia buat nilai dia artis atau bukan. Hahaha semua org indo jg pasti setuju kalo kador bukan artis tp cuma celebgram dr kampung. Lo tau kan bedanya artis dg selebgra
0, <USERNAME> hahahaaaa trs gue tanya. Lo tolol? PAke nanya kador bencong atau ngga padahal blm kenal wkwkwkwkw. Eh semua org jg bisa nilai si kador bencong beneran dr gerak gerik melambay suara ngondek dan pake baju cewek begitu nyaman. Mana ada cowok tu
0," <USERNAME> maklumin shaaay... Fans gatis keras itu otaknya bebel, realita seperti apa jg ga bakalan dia terima... Seperti halnya nagita itu artis uda dr jaman dia kecil eh di bilang numpang tenar ke rapi mamad,pdhl kan yg jadiin si mamad gede y PH n"
0, <USERNAME>.bee idih najong lu tag2 org! Nimbrung aja kek mujaer lo! Dia ga bakal terkenal klo ga bawa2 nama ayu ting ting sm nagita! Duh bego dipiara! Kesian
0,"langsung saja bilang siapa yg di maksud, klu gini namanya MUNAFIK!"
0,"Jedar emg muka 2 kali, didepan baik, dibelakang busuk, mulutnya kek banci cucoklah 2 banci tu"
0,AMIT AMIT DEH ORANG JAHAT... PENJILAT PEMBOHONG PELAKOR JIJIK BANGET
0,"Wkwkwkwk... Ya Allah ya Tuhan ku knp lah org2 munafik ni tp sok suci, mulan jamela kan ayu ting2 ngikuti jejak a bukan? Wkwkwk  <USERNAME>"
0,"Dlu si pelakor ini yg sombong krn brhasil dapetin si botak smpe mnceraikan bunda maya,skrg hdp ny mkin anjlok malah bunda maya yg sring jelong2 kluarnegri..??????"
0,Hahhahaha dan sesungguhnya allah swt melaknat wanita perebut dan pezina dengan suami sah oranglain ????????
0,"@w.lina2706 hemmmm capekmiskin sist, skrg blik kere lg jd artis jg g laku, dah lah karma tu pasti ada...  <USERNAME> dr pada sirik nyinyirin nyonya, tuh bantuin jualan cireng nya tuh, cilok nya tuh untunnya buat liburan monaco, jangan bromo trus"
0,Kepo juga sm nyonyiah lu jongos  <USERNAME> emng tetehlu pas hamil peak udeh dinikahin ?? Brojol anak br di sirih EMNG LONTEEEEE kelas akun jamahliur dan junjungan hehe ??????
0,"Eh jongos cba gue duluan yg nanya sm lu .. emng nyonyiah ada gembar gembor udah nikah.. adakah nyonyiah ngaku udeh nikah ???? Dr pada tetehlu yg lonte perek itu tiba"" brojol dan ngaku nikah siri sm laki nyonyiah dan hamidun sapeak anak ilegal dibilng FITNA KEJI haha lonte menolak lupa xixix ??????  <USERNAME>"
0," <USERNAME> sini gua jawab currr ya bunmai sdh pernah nikah Tp sekarang janda dia janda karena suami nya di rampas Mulan jameela,menjijikkan banget ya Mulan jameela sblm rmh tangga bunmai hancur sdh berani bilang Dani suami bersama aduha udh wanita be"
0,"@w.lina2706  <USERNAME> lucu aja ya sist, lonte di bela2 mati2an... Guoblok di pelihara, di bayar berapa gt sama muljamban, sampe bikin account  <USERNAME> mau maia nikah atau blm nikah apa urusan situ, kelihatan nyinyirnya sirik nya. Sekarang balik"
0,"Yaela muljem kyak stu bner aja. Gag inget apa udh ngrusak kbhagian klwrga org. Bego d prtahanin y gini ini,"
0,Banyak lakik doyan banci! Jadi banci & kawinin banci.... jijik!
0," <USERNAME> itu comment yg tidak anda lihat, ada brp banyak. Jangan jadi pengguna medsos yg bodoh jangan asal bunyi. Situ sehat pakai hijab masi nyinyir aja??"
0," <USERNAME> malu tuh sama kerudung kamu sayang, sama ibadah nya. Sholat aja drpd nyinyirin org dandanan udh sok suci mulut nya kaya sampah??"
0," <USERNAME> tolong di baca arti dr comment saya, udah kerdus+bodoh lg bilangin org tua nya besok kalo masak jangan pakai mecin, jd udah kerdungab ga sesuai mulut. Besok makan salmon kalo g mampu besok aku tak deliv ke rumahmu ."
0,"Maaf mukanya jelek terus attitude nya buruk,,spesialis plagiat,,dan ketauan pula ,,,"
0,"ini orang otaknya ga pernah di sekolahin ya? itu resiko ketika udah upload sesuatu di sosmed, ya pasti bakal dapet perbincangan dari netizen. public figure kok ga ada otaknya."
0,Artis kampungan wkwk
0,"Iyaaa gue pernah pacaran? Udah nikah malah, tapi gak seNORAK eloo.. Gak risih emang? Jgn asal aplod, Perhatiin followers lu yg lumayan banyak itu, tar kebawa norak."
0,y ampun pnyanyi dangdut kurang tenar songong bangt BACOTNYA ??pngn nyari sensasi tapi kmpungan bangt deh amit amit bool ko d instastory
0,Waaaaoooo..sopan sekali.. bahasami menunjukkan kelasmu !!! Heeeehh.. yg repot ama hidup lu siapahh ?? Elu live nampilin hal2 gak penting..yg nggilanikk.. menjijikkan..diliat org banyak.. ya pantes lah dikomen..klo gak mw dikomen videoin pribadi aja.. nonton sendiri lu ama kluarga lu di rmh.. nambah lagi niy ertong yg gak pny attutude!! Kampungan!!
0,"Norak sih,kayak ga ada malunya.kl dia bilang terserah dia,ya udah,simpan fotonya.gak perlu dibagi kesemua orang.lah ini dipamer kemana,resikolah dinyinyiri orang.Insecure banget,kudu ya pamer2 gitu biar semua orang ngerti kl si mbaknya udh py pacar yg bisa dipamer2 pantatnya?Kampung bgt"
0,Koq marah sehhh???dasar wanita kampungan...??
0,Kampungan.... Artis yg numpang tenar gara2 mukanya mirip Katy Perry doangÖ
0,Susah kalo artis kampung
0,"Ah min, gue lama2 gak suka sama akun ini nih! Berita nya basi! Lo liat dong min.. itu si kellen sama amora lagi dateng.. pake ikut jingkrak2 kok!! Lo saring dulu dong min.. biar berita nya gak blunder.. lo posting juga tu KD udah posting videon kellen ma amora lagi joget2 ma si arsya arsyi!!"
0," <USERNAME> iya""km bening, kelewat bening jadi buluk kan ya mbak ?? mbaknya baru nelen apasih komen kaya gini? Apa baru kesurupan ?"
0,"kita sekeluarga sangat ngefans dan kagum lihat  <USERNAME> semua nya deh.tapi lihat anak nya yg jelek,buluk kan.  <USERNAME>.hermansyah  <USERNAME> kutuk kan apa yg menimpa bunda KD untung Allah swt sudah menggantikan amora dan adik nya.gemezzzzzzz lihat nya cocok banget jadi Anak artis se class bunda KD ??????"
0,Emang dasar si anak nya aja yg lebay....urusan pribadi di umbar..biar di blow up... hadehh..gunanya whatsapp sms or telp buat apa..suka aneh....
0,"Coba liat bibir mu sayang, seperti pantat ayam. Wajah mu bulukan seperti kentut?? perfectoooo?"
0,Gagal fokus dengar suaranya.. koq jengkel ya dengernya... sorry cuman manusia biasa kalo jengkel????
0,"Muljem ngomong gak jelas blepotan, gak nyadar mau idup enak aja pake rebut laki orang dulu"
0,??lucu ya si yg bikin kata2.bawa2 Tuhan.kalau dah kepepet. Masa dia ga tau ibarat apa org yg merusak rumah tangga org.ibarat merobohkan bangunan masjid mbak nya.bayangin aja seberapa besar nya dosa mu.nasi dah jdi bubur mba nya moga bisa bahagia di dunia.??
0,Iyah bener. Tidak Akan merubah pandangan Tuhan terhadap Kita. Terutama elu Setan!! Makanya mikirrrr.. suami majikan kok diembat!!
0,Gilingan mulan jalang lg kasih ceramah. Hahahaha . dasar cireng gak tau diri gak pernah ngaca. Si cireng lg ceramah sok2 kyk pahlawan kesiangan biar bisa berteman ama sekuter kyk selpii ini.
0,"Ya pandangan Tuhan terhadap lo juga jelek sih gue rasa, dikira perebut suami orang tuh mulia apa dimata Tuhan?????????"
0,"Karna sejatinya kau adalah setan berwujud manusia ,,karna pekerjaan setan ya menggoda manusia ????"
0,Pernah ngga mba  <USERNAME> baca ada netizen yg nyesel ga bs nimpuk telor ke si mulan..gw aja ketawa bacanya krn terwakili. Ya ngapain buang2 wktu ketemu orang gak mutu dng si mulan...msh untung nyempet2in bs nuli? disini biar nyadar tuh pelakor ga punya harga diri. Mending ketemu org baik2 spt bunmai...ketularan aura positifnya.
0,Editanx paraaaahh...oplas aj laaah nyai drpd ngedit2 gn hahaa kn maluuu
0,"jelek,lecek,bantet ??????"
0,Gini amat pengen tenar ya ampuuun...malu kalo jadi anaknya yah kasian
0,"Heran gw mak  <USERNAME> knp dia masih aja di pake ma AN*V di pesbu**r. Kasus ny bederet, skandal bertubi2.... Gk ada malu ny ?? muka tembok ?? sangat gak ada faedah ny nonton acara yg ada si manusia kardus ini ??"
0,"wey org goblok juga bisa bedain vape, shisha sm rokok. jelas jelas lo ngerokok pake acara ga ngaku segala"
0,Jijik saya liatnya...kaya ulet bulu kluget2 gitu...hihihi..ampe sgitunya pengen terkenal...!!
0,Jablay anjir mukanya... Murahan bangetttt najisss
0," <USERNAME>.alycia iya sist jijik banget gw liatnya sok suci ngatain orang kalo gw sih malulah artis papan atas tapi otak gak di fikir kalo ngomong ,ketauan bngt gada wibawanya kalo emang dia nyadar dia siapa seharusnya dia tau cara berkomentar manusia gada yg "
1,yang sabar yaa.. insya Allah menjadi pembuka pintu syurga dan penghalang api neraka bagi kedua orang tuanya
1,Lagu barunya mbak tata kan kisah nyatanya rumah tangga mbak tata.... jadi rasanya mbak tata bener2 sayang get sama suaminya... syukur kalau baikan.... semoga awet...
1,"Yg komen kenapa si mbak ini ga sedih malah ketawa2.. ya iyalah klo kita dah disakiti sm pasangan smpe berlarut2 ngapain juga sih kita sedih ampe depresi segala.. serahin sm Allah aja..bawa happy aja mski sakit.. lagian si mba senyum2 di wajahnya tp hatinya mana tau kan... senyumannya bs jd buat menetralisir kondisi hatinya yg lg terpuruk... ada pepatah bilang ,, klo bahagia jgn trllu bahagia, klo sedih juga jgn trllu sedih... diimbangi aja biar ga gila ??????"
1,"Suka banget sama pasangan satu ini. Semoga gigi dan raffi menjadi keluarga sakinnah, mawaddah, warrahmah. Semoga tidak ada pihak2 yang ingin memisahkan mereka. Jodoh sampai maut memisahkan. Amiin"
1,"Jemima kan anak angkat celine, eleeya anak hubungan celine dan dirly. Dan saya terharu saya tau kalau jemima adalah anak panti asuhan yang dia rawat. Dan wajar kalau stefen lebih pilih celine karna hatinya baik"
1,Lucu yg blg stefan menghabiskn masa muda wkwk.umurnya mah gak muda mukanya aja yg baby face. Bersyukur.bonus buat celinenya?? lah dlu mantannya begimane. Dibawah umur ude pacran mcam laki bini. Hiks. Selepas tu yakin deh susah mengambil keputusan kaya stefan. Tipical cowo yg tnggung jwabnya tinggi
1,Dan lagi ada yg masih bawa2 keenan ????. raisa udah paling berbahagia ngedapetin suami yang super ngemong dan mature kaya hamish. Raisa itu cukup dewasa di banding wanita seumurannya yang masih mikirin dirinya sendiri. Jd menurut gue raisa dan hamish sama2 beruntung bisa menjadi sepasang suami istri. Ga ada tuh gagal move on ???????? so congratz raisa dan hamish. Semoga pernikahannya sakinah mawadah dan warahmah
1,"Raisa cantik yaaa, meskipun artis tapi ga menonjolkan kalo nikah tuh harus mewah, udah cantik, sederhana, sempurna bgt,"
1,"Karna orang yang syudah cantik, ga perlu dandan heboh utk membuatnya terlihat cantik.. dengan makeup yang simple gitu aja sudah mempesona?????? bikin hamish klepek2"
1,Bagus dong.. mencari ilmu kapanpun dimanapun.. itu karena suaminya orang berpendidikan ????????????
1,Sukak cewe cantik dan kmauan blajarnya tinggi ???
1,"Yaampun ini artis bener bener good attitude yang layak jadi panutan. Dia kan bisa aja kuliah di luar negri. Tp karna baktinya sama suami , dia pilih kuliah di wilayah dekat suaminya . Salut banget"
1,"Semangat batman  <USERNAME> kita VA selalu support kamu karna setiap manusia pasti pernah punya kesalahan ???????? ,, dan buat yang lain tolong jangan di bahas lagi pliis karna itu udah 2 tahun yang lalu ????"
