Sentimen,Comment
1, <USERNAME> y udh .salam knl y mbk seneng bisa knl sm mbk. Sbagai manusia kita saling ingetin.y sbagai manusia kita hrs tau diri jgn sombong yg digedein mentang2 dah jd artis haha..y udh mbk kita cabut ja y dri komen d foto ni nnt kita jd korban dy sel
1,"keren yaaa, kesederhanaannya terpancar jelas. sukak sm keluarga presiden ini??"
1,"Seorang presiden tanpa embel"" gelar .. bangga sekali"
1,Proud of you Indonesia. God bless Indonesia
1,Amazing bngt Miss National Costume. Kereenn!! Bangga ama budaya indonesia ????
1,Ikut bangga pastinya ??
1,PROUD OF YOU KAK DEA. Sangat patut dibanggakan??
1,Suka bgt sm pidatox dy cara pembawaanx bgtu elegan n brwibawah pntas mmg dy mdptkan.salut
1,aku percaya kak niki orangnya jujur semangat kak niki???? hebat
1," <USERNAME>.m sama Mba! Gua jg ga bisa benci Nikmir. Salut malah ama dia ga muna! Artis lain maaf image aja di dpan, sok baik, sok teraniaya n jual air mata. Nikita ini real.. sygnya msyarakat kita cendrung yg dilihat apa yg ada di superfisial"
1,cantik alami tanpa perlu bedak tebel dan gaya bak tante2
1,Cantik dan gagah mudahan lancar dampe hari h
1,"Cantik yang ini dong,penampilannya dewasa yang sesuai. Mukanya cantik Indonesia,classy. Ayu ayu gimana gitu."
1,"Lcb cantikk sangat??, lcb beruntung dapet duren dan duren pun beuntung dpt neng lcb. Sakina mawaddah warahmah Amin"
1,"dia ganteng tidak hanya saat berseragam, tapi ganteng saat menjadi panutan keluarganya.. semoga anak saya memiliki fisik yang elok macam mahluk Allah ni"
1,"Beruntung banget deh mba  <USERNAME> dapet mas  <USERNAME>. Ganteng,baik,sholeh,sayang keluarga.ini suami idaman banget.semoga selalu menjadi keluarga yang SAMAWA"
1,Smoga mas Agus menjadi pemimpin di masa akan datang.salah satu pemimpin yg sukses adalah dia sukses dlm memimpin dlm rumah tangga
1,"Dear...Bpk  <USERNAME> cra berpakain bpk sangat lah mencerminkan kepribadian bpk yg sngt lembut tpi tetap gagah semoga bpk  <USERNAME>&kel selalu dlm lindungan allah swt, salam hormat dri saya yg selalu mengagumi bpk :-)"
1,"Sukses terus kak ayu dan semoga selalu senantiasa dalam naungan Allah SWT, dan sehat selalu amin..."
1,"Smg selalu di berikan kesehatan dan panjang umur yah nek ,muda banget cantik dan MashaAllahhh"
1,Terimakasih Ibu  <USERNAME> serta seluruh keluarga telah memilih Plataran Darmawangsa sebagai tempat acara keluarga Besar. Saya selaku bagian staff di Plataran darmawangsa sangat terkesan dan sangat menunggu kedatangan Ibu dan keluarga di lain waktu. Sehat selalu Ibu dan keluarga. Amin amin ya rabbi
1,"Salam Dirgantara! Terima kasih telah mendukung dan menyebarkan awareness terkait program pesawat R80. Semoga momen emas ini menjadi titik awal kebangkitan industri pesawat terbang Indonesia agar kembali berjaya. Bersama Eyang Habibie, yuk kita satukan langkah terbangkan pesawat R80. Caranya? Langsung klik link di bio kami yaaa ????"
1,"Semangat ya eyang habibie, sehat selalu, selalu dlm lindungan Allah, ambisinya selalu kuat dlm melakukan segala hal. Kereeeennnnn. Semoga bnyk penurus2 bangsa sprti eyang Habibie ????????????????????????"
1,"Memiliki Cucu2 merupakan kebahagian yg tak ternilai, cucu sbg generasi penerus bangsa..."
1,Wahhh Kerenn..... dan saat ini tempatnya semakin bagus Ibu. Kapan kapan Bernostalgia di sana lagi bersmaa keluarga ??????
1,Cantik dan ganteng-ganteng. Sehat selalu untuk mereka dan Bu Ani Sekeluarga ????
1,Barakallah dengan cucu2 yg cantik dan ganteng ... semoga menjadi anak yg sholeh dan sholeha ... menjadi kebanggaan kelg...????
1,Bu  <USERNAME>...cucu bikin hati kita gembira...ngangeni...kadang kangen sama keceriaan mereka...salam kangen buat cucu2 tercinta
1,"Yang kecil lucu, yang tengah ganteng parah, yang gede pinternya ga ketulungan, salam hormat saya bu, pak"
1,Terima kasih pak SBY & ibu Ani yg selalu menemani beliau..& sudah memberikan Kontribusinya yg sangat Luar biasa kepada Indonesia selama 10 tahun memimpin..semoga selalu bahagia & sehat selalu..amin
1,Setiap caption yang di buat ibu..dan setiap kali saya membaca captionnya secara tidak langsung saya belajar bahasa Inggris ... Terima kasih ibu... Secara personal saya tdk mengenal ibu Anie tp saya yakin betapa bangganya Anak Cucumu bisa kamu didik ibu menjadi generasi bangsa yang mandiri dan unggul ... Sehat terus ibu .. Semoga Cinta Kasih dalam Keluarga selalu engkau tebarkan untuk mereka ...
1,"Assalamualaikum ibu yang terhormat. salam dari kami sekeluarga di banda Aceh. kami semua sangat membanggakan keluarga ibu yang sangat membahagiakan kami bila melihat nya. sikap etika perilaku keluarga ibu sungguh sangat bijaksana apalagi mas agus, ibu.. suami saya terlebih lagi sangat yakin pada saat bapak mencalonkan diri jadi presiden dulu beliau sangat bangga pada bapak salam hangat dan perkenalan dari keluarga kami ya bu (Darmanto Rapi photo studio)"
1,"senang liat ibu n bpk sby menikmati hari tua brsama cucu tercinta ,, sehat trs ya memo n pepo ,,, Allah SWT melindungi memo n pepo n kel #kisss"
1,Semangat mebangun indonesia yg lebih maju pak jokowi ????
1,"Artis berkualitas, wajahnya itulohhh berkualitas bgt hihi.. Cantik bangetsss.. Top deh.. Ga pake drama dan gimick idupnya hihi.. Tajir tp. Sederhana"
1,Mba via sptnya siyok melihat kejamnya dunia per artis an... mudah2an tetep sabar tetep berkarya dg baik... ????
1,"Selalu suka sama via,org nya jujur apa adanya kaga gimmick2an hidupnya..hitam ya hitam,putih ya putih..kl ngomong blak2an,kl ngga suka dy ngomong jd ga pura2(gw banget sih),apa adanya ga munafik..sprti ajaran ortu gw..jangan suka memberi senyum kepalsuan????ga kaya artis yg onoh noh yg mulutnya lebar kya gorong2,tukang ngibul,munfik bgt kl ditanya wartawan jg jawabnya,perilaku ama omongan ga balance????"
1,"Go a head Via...... Cuekin ajalah, udah biasa itu dalam pergaulan dunia kerja dan masyarakat biasa, apalagi pergaulan ertong. Pastilah ada yg gatel bin sirik klo liat orang sukses, anggep aja kuman gak usah dibikin status, malah kesenengan mereka ada bahan buat ngetawain. Betul nggak?? ??????"
1,Gagah kali abang borisq ini.. Klo gk bc nmx bner2 gk ngeh klo it bang boris...??
1,Weewww bangga kali ak liatnya bang  <USERNAME> pake baju adat karo.... Syip
1,Bagus banget baju dan pengantinya happy weding
1,MasyaAllah . bagus banget ..
1,Gileee suaraaanyaa.. kereen parah.. sukak
1,Lebih keren dr penyanyi aslinya
1,Kereeeeeeeeeeeeeeennn sampe merinding brrrrr
1,Yatuhan suaranyaaaaaaa bagus bangetttttttt
1,"Keren suaranya super merdu. Coba ikut audisi nyanyi, pasti bakatnya bs tersalurkan"
1,Bagus drpd beberapa artis yg modal tampang doang pdhl suara juga jelek. Mendingan mas ini yg nyanyi. Emg dasar nasib org yak gk ada yg tau. Semoga masnya bisa sukses
1,"Dgrin ini sampe bulu kuduk naik saking bgusnya, masyaallah apik bgt suaranya"
1,Subhanallah tergetar hati dengar suara nya
1,Masa allah suaranya bagus banget cantik lagi orangnya idaman semua cowo
1,"Bagusss suaranya, penampilannya juga sesuai anak sekolahan, natural dan sesuai dengan usia nya"
1,Kerennnn suaranya bagus
1,"Cantik, polos, apa adanya tapi keliatan berbakat. Semoga kalau udah tenar gek jadi selebgram, kalian ga kaya2 si mba Novilda ya dek yg kehilangan arah. Tetaplah begini,jangan cepat tumbuh dewasa dan terus asahlah bakat kalian, Allah bless you both."
1,"Bagus iniii, ga kaya yg pingin terkenal, rambut di alus2in dlu. Muka di makeup dl. Biar dikamera keren hahaha. Kl mereka bnr bnr keliatan lg lelahnya abis pulang sekolah ????"
1,Di ulang berkali kali sampet gak percaya klo ini suara aslinya. Bagus bgt ??
1,Alhamdulillah masih ada kidz zaman niw yg berkarya sewajar seumurannya bukan yg sok gede
1,aduhh kerennnn suaranya enak . nge jazz2 gimanaa gtu . muka mah belakangan aja . ntr klo udh tenar juga muka mengikuti hahahahahaha . skill dlu nomer 1 . ini batu abege jaman now ????????
1,Kereeen nih...enak bgt didengernya...gak bosen puter ulang2...daripada yg lipsing2 gajelas joget2 gtu...
1,waduuhhh...Kereeen bangeeet dedek2 emeesh
1,Klo aku sih yes bingits...coba ya seandaix anak2 buat video sprt gini atau video kreativ lainnya kan bagus dripda buat video mesum..atau ngelem dll yg berbau negativ bikin dosa dan maluin ortu dan diri sendiri
1,Bagussss + dandannya natural ga banyak permak kayak anak jaman now lainnya ????????????
1,Kereeeeennnn padahal nyanyinya santai banget ????????????
1,Polossss...keren....ga neko2 kayaknya...jossss
1,Yesssssss !!!!! Bagus bgt !!! ?????? Kids jaman now yg begini yg diksh jempolllll ????????
1,Wajah2 anak skul bgt yaakk mase alami bgt suka liatnya ???? lagu ma suara keren palg yg pake bando suaranya mantap ??????
1,Keren suaranya dasarnya cantik tinggal di poles dikit bersinar??????
1,"Pembagian suaranya pas bnget,pecah suaranya jg cakep"
1,keren bgt suaranya.tinggal dipermak aja biar tmbh cantik.viralkann....
1,Kereeeennnnnn... suaranyaaahh okkeehh ketjeeehh badaaiik ughllaaaallaa..
1,"Yes yes yes..kirain lypsinc habisnya mirip sih suaranya,eh pas dua2nya nyanyi bareng baru ngeh asli..kereennn"
1,Keren yg penting punya bakat dulu ntar jg klo udah jd artis banyak duit mukanya bisa cemerlang
1,Keren min orang2 yg berbakat kaya gini yg harus di up ke publik????????
1,Kereeen bgt suaranya. Nah kyk gini dong kids jaman now...??
1,mrinding... bagus poll... d jaga ya dek kepolosannya... ???? jng smpek kyk si aw2 dkk.. ??????
1,"Kereenn sumpaah,, kebangetan bagusnya..??"
1,Ya ampun lakikny ganteng. Rini nya juga cantik. Mungil pula skrg.
1,"Suaminya swett... keliatannya syg bgt ma istrinya, ganteng lagi... Haaaaaaa ?? so swett lah... Smg langgeng slluÖ"
1,"Wah Mbak Rini hamil ya ?? Selamat ya mbak semoga kandungannya sehat"" aja & juga mbak rininya , makin bahagia di hamil yang pertama , dan semoga lancar di proses persalinannya nanti ????"
1,"Kasian anaknya,, jgn sampek anaknya rusak jugak kek emaknya yaa"
1,Kalo pasangan cantik + ganteng suka deh liatnya?
1,"Wah akhirnya hamil lagi juga. Selamat ya mbak Sandra semoga kehamilannya makin sehat"" saja , makin fit dan semoga lancar di prosesi persalinannya nanti. Wah udah jadi calon ibu nih"
1,ikutan happy....sukakkk bgt sm nih couple...salah satu pasangan sempurna menurut gw
1,"Pernah lihat di infotainment sebelum nikah, wkt ditanya persiapannya jelang pernikahan, sandra dewi bilang klo dia sama calon suaminya pengen banget cepat punya anak nanti hbs menikah, krn mereka suka anak kecil, bahkan mereka sdh prepare program2 yg akan mereka lakukan klo dlm wkt dekat blm dikasih anak, but finally...congrats...semoga lancar dan sehat trs sampe lahiran ??????"
1,Keluarga ter-humble ter-sempurna ter-sederhana dan engga pernah sok terlihat kaya dan ga pnah manja pake pesawat jet pribadi kayak yg lain lain ??????????
1,"Bunda maia cantik semoga slalu sukses, sehat trs ya cantik wajahnya secantik hatinya"
1,"Artis yg gue kaguminn.. Nikah muda, ga neko2, syg keluarga syg suami,, mengutamakan anak2.. Ga puyeng ama dunia hiburan dan ke artisann.. Padahal tajirrr mampuss.. Plus ga alayy dan ga aneh2.. Salutt ama niaa.. Smiga slalu samawa.. Yaa nia and famzz???????????????????????????????"
1," <USERNAME> iya aku sih jujur bukan fans Nia, biasa aja sama dia, pas dia tenar banget sama sinteronnya juga aku biasa aja. Tapi makin ke sini kalau soal urusan keluarga, aku salut ama dia. Dia kan masih muda ya itungannya, sama aku cuma beda 2-3 t"
1,Smnjk hbs nikah auranya keluarr bgt. Suaminya jg kliatan syg dan nia nya kliatan baik gt tulusss.. sukak deh liatnya.
1,Mngkin s mba nya marah2 krna ad kata2 yg ga enk dr yg komen..wajar lah kl dia marah..toh it kan cuma foto biasa aj.. Ko jadi malah mba nya yg d bully..sampe bawa2 fisik sgala.. Kan ga bgus.. Pinter2 lah kita mnyikapi medsos.. ????
1,Cantik banget yak.. Punya anak cewe begini puyeng kali yak jagain nya ??????
1," <USERNAME> iya betul mba. Ariel gak ganteng. Tapi ariel punya kharisma yg menarik. Udah tua pun skrang agak keriput wajahnya ttp aja kharisma nya sebagai lelaki keliatan lebih terpancar. Buktinya mama, dan tante saya makin tergila2 sama ariel dan sa"
1,"Jadi manusia Saling menghargailah, kalo tulisan yg ditulis itu tidak berguna bahkan menyakiti hati orang lain. Ya sebaiknya tidak usah tulis. Pergunakan sosmed dengan smart ya guys!!"
1,entah kenapa kalo liat  <USERNAME> bergaya apapun ttp kliatan bagus... suka sama lgu nya.. sukses trus kak
1,banyak bangat emasnya.jadi salpok diemasnya.tp sumpah lagunya dan music nya keren bngat.apalagi konsep mv nya ia ambil handel.kan keren menurut saya.kalo denada taro kutang diluar itu krn masih minim perestasi.tp kalo agnes itu hal wajar.prestasi dan dunia fashion kalo artis indonesia ia selalu unggul.krn ia berani meski gak cocok ia pake
1,"Coba deh yang pada kritik2 itu bikin karya sendiri, siapa tau lebih bagus dari yang mereka kritik"
1,"Pada protes kenapa sih??yang protes itu coba usaha deh..Jangan kira usaha dia pendek ya!!.Butuh waktu lama dia agar bisa go international.Jangan cuma protes,klau pengen yang kalian inginkan ya kaliam sendiri dengan cara sendiri agar kalian bisa go international"
1,"Keren, ga suka ma agnes, tp suka ma lagu ini, n jd suka jg ma y nyanyi, santai lagunya tp asyik"
1,"Bandingin lagu Go Internasional yang paling ngena di gue ini seru enak didenger....... Tapi tumben agnes gak memberikan bumbu Indonesianya kaya ada Batik"" gtu atau apa.."
1,"Nah ini baru keren, daripada mba mba superman wkwkwk"
1,"Sumpah gua suka bgt sama lagu dia yg ini, asik bgt di dengernyaa"
1,Enak banget mak lagu2 dialbumnya paling suka yg inih sm beautiful mistake
1,Mantap .gw suka bngt ama agnes.karena dy artis yg bertalenta .dan ke kayaan dy ga pernah dipamer ky artis ygblain.gw suka dy ga pernah pamer.keren bngt
1,enakk musik nyaa . apa lagii lhatt ka agnes nyaa dance kaya nyaa nyamaann dan enakk bgt tuh kayaa nyaa
1,"Asik bgts dancenya,apa lg lagunya mancappppp"
1,Ganteng banget meski aura... Kenceng banget & diragukan.semoga langgeng mami..
1,"Mami depe cantik banget. Awet muda, ngga kalah sm penyanyi pendatang baru. Semoga samawa...  <USERNAME>"
1,Ganteng yesss. Mami cuco deh sama babang. Semoga langgeng ya unchhh lope mami
1,Mbak dewi jadi lebih sabar keliahatannya... Keren semoga semakin langgeng
1,Soal pasangan hidup ijk salut sih sama mami depe.. ga matre n neko2.. yg penting single n cocok doi mau diajak merit.. ga kyk tetangga sblh saking matrenya suami org di embat jg..
1,mau duda mau singgel itu ngak masalah yg penting laki jaman sekarang setia menemani dunia akhirat amin good luck dewi persil sehat slalu dlm berkarya
1,Muantepp ganteng...selamat menempuh hidup baru mg langgeng rumah tanggax bhagia n selladem ayem...??????
1,"Mb depe langgeng yo karo masny.mb ibuku ngefans bgt sm mb depe dri mb sm mas saiful dlu smpe2 blng jdi pembntuny gapapala ktny,pgn bgt ktmu mb depe ibuku kami dijambi mb"
1,Jangan di dengar kata 2 yg menyakitkan hati lebih baik tenang jalanin aja dengan pilihan andah sendiri bahagia itu biasanya ada di kata hatimu maju trus dan sukses bersama pasangan mu
1,"Cakep,ganteng pacarnya dewi persik,udah ini aja jgn ganti lg yaa dewi"
1,"Beruntungnya Bella.. Orang2 jadi fokus ama komen lakinya. Coba kalo ngga, pasti model bajunya yang diceramahin ama netizen ??"
1,Beginilah pasangan suami istri yg normal.. Romantisme hanya dia dan istri yg tau. Ga perlu diumbar.. Tp dijaga. Yg suka umbar kemesraan iti kebanyakan menutupi kenyataan yg sebenarnya.
1,"Naksir Ama ceweknya, kyanya lembut banget Kya bolu ??"
1,Cewex luar biasa cntik... Cowox.. Mmmmhh hehe
1,"Cewenya cantikk, the power of tajir ??"
1,Alhamdulillah lebih ganteng babang Emran ya  <USERNAME> ??
1,"Alhamdulillah  <USERNAME> gak jadi sama yg ini... engku emran masyaallah ganteng, anteng, sabar, sholeh, penyanyang, senyumnya cute.. baper dech"
1,Cantik manis cewe nya .. cocok ajalah
1,"Cewenya manis, cakepan yg skrg Dr yg kmrn ga jd."
1,yg ini lbh cantik sih. hebat jg ni lakik ciwik nya cakep2 lho..
1,Semoga betul klo sma yg ini mh....klo bella mh udah dapet yg amat sangat pas lah????
1,"Semoga ga putus lagi ya. Ka bella udah bahagia banget tuh, ga malu??? ??????"
1,Yaampun cantiikk bangett aslii! Angguunn ??
1, <USERNAME> euum setuju sekaliii emang cantikan ini dari pada yang sebelumnya. Lebih WOW... ?? terbaik ?? terpelihara hehe
1,"Cantiik, senyumnya mirip Maudy Kusnaedi"
1,"Dari kisah jevin radhini rini gue jd belajar 1 hal. ""Kalau memang jodohmu, maka akan ada saja jalanNya"". Gue kebetulan ngikutin dr awal. Gue nonton pas live the remix jevin ngomong 'itu pacar saya nonton' sambil nunjuk radhini. Gue jg nntn pas jevin meluk radhini erat bgt di backstage stlh lolos ke final. Keliatan jevin ini anaknya gentle, tulus dan penyayang. Tapi Allah maha pembolak-balik hati. Mei '15 jevin radhini pcrn, sept '15 jevin rini dipasangin the remix, Des '15 final the remix, jan '16 jevin radhini putus, feb '16 jevin rini pcrn, april '16 jevin ngelamar rini, feb '17 jevin rini tunangan, mei '17 jevin rini nikah. Allah works in many ways??. Allah's plan is better than our plan. Jevin yg dulunya berfikiran akan nikah umur 30, siapa sangka di umur 25 dan dlm waktu pcrn baru 2 bulan udah yakin ngajakin anak orang nikah. Ah, happy wedding soundwave. Bahagia selalu??"
1,"Kalau kita bisa mengartikan jodoh,ini lah yang di bilang jodoh.cantik lahir batin tapi kl ga jodoh perpisahanlah yang terbaik.."
1,Pingkan ni suaranya enak banget.. bindeng2 gimana gt.. berciri khas.. ibarat gw merem denger suaranya gw udh langsung tauk
1,Hatinya terbuat dari apa ya .. Mbaa gigi yang berhati luarbiasanya ajah sampe di benci .. Cobaa sebutin heternya mbaa kesalahan apa yang mba gigi lakukan :'( duhh aku ajah jadi sukak sama sifatnyaaaaaaaaaaa
1,"Suka banget banget nih sama ni artis, gak neko neko, ternyata masih lahiran 1996 ??????"
1,"alhamdulillahhh... ada juga yang ngepost ayangnya Ibel.... biarin deh damai seisi dunia.... masing2 sdh punya pasangan, jadi engga ada lg yang bilang Ibel PHO.... Happy b""day Ibel"
1,"Ini kakaknya murid2ku waktu msh ngajar di sekolah internasional mihil. Anaknya cantik2 dan si ibu dan bpk ramah dan baik bngt. Seluruh sepupunya di sekolah yg sama, yg uang masuknya aja 70 jtan lbh/siswa. G tau skrg brp."
1," <USERNAME> justru karena ka bella sholehah, punya penghasilan sendiri, dan cantik jadi Allah mau kasih jodoh yang lebih baik lagi.."
1,"Mbak bela, nikahnya berdasarkan atas dasar agama mbak yg diutamakan ya. Biar laki2nya dpt yg baik. Saya yakin banyak laki2 yg baik dan kaya raya yg mau nikahin mbak"
1,Duh geulis kitu ditinggal sama yg 'itu' duuuhhhh hahaha jodohnya pasti Allah kasih yg lebih baik Teeeh ??
1,"Bu Ameeel.... udah lama ga ke bank,kangen bu Amel yg cantik,ramah,baik ama kangen tentengannya hihiii ????. Nanya si mba bu Amelnya pindah rumah dan lg hamil. Sehat2 yaa bu Amel,salam buat Annabel"
1,"Ambil positifnya aja mbak toh oma nani yang menjalankan, mau mbak bilang gimana nggak mungkin kan oma langsung cerai karena itu udah pilihan hidup dia gimana jadi lebih baik didoakan semoga langgeng karena menikah juga ibadah heheu  <USERNAME>"
1,"Alesha arti namanya : Yang dilindungi Allah....aamiin yra, ya nak...."
1,Semoga anak nya bsok pas bangun langsung jd dewasa biar bisa bakal jodoh saya???? pasti gedenya ntar sama cakep kek kakaknya Fahri..
1,min mnta doanya jg buat saya mudahan dilancarkan dan selamat saat melahirkan bulan mei ini. Aamiin
1,"Waaah.... Hamil Malah makin cantik, cew kali yeee debay nya.... ??"
1,mba acha cantik banget banget banget !! buat calon ibu yg blm d kasih momongan sm Allah smoga di segerakan ya ??
1,"Gemulai'nya Momo,, Bak Putri keraton Jawa,,, semoga bersatu selama'nya dan cuma Maut yg memisah'kan,, Gbu..."
1,Berasa kaya mau manggung kk  <USERNAME> ?? semoga lancar dan cepat punya momongan biar Ada Princess Kecil MoMo atau gak prince ??
1,"waaahhh sm dokter sigit ya, ini dokter the best banget, baik banget, humble orgnya, recomend banget buat yg mau program dan kehamilan ??"
1,"Ashanti bunda the best, Slalu belain/support anaknya. Mskipun bkn ank kndung??"
1,Smua orng berhak untuk melakukan apapun yg mereka suka.. Asal g mrugikan dirinya ataupun ornglain.. Mau aurel dandan berlebihan atau natural itu hak dia.. Apalagi aurel pinter banget dandannya.. Kliatan cantiiik banget.. ????
1,Beruntung si aurel dpt ibu sambung kaya ashanti .  <USERNAME>
1,salut ma bunda  <USERNAME> .. mskipun ibu sambung.. tpi sellu jdi org yg plingbdpan mmbela aurel n azriel dri pra hatters..
1,"Keren ya ashanty segitu sayangnya sama anak nya(padahal bukan anak kandung), yang ibu kandung aja blm tentu begitu. Ini orang hatinya kek bidadari di tv tv. Beruntung banget itu aurel azriel punya ibu tiri macam dia"
1,"Salut buat Bunda  <USERNAME> slalu yg trdpan melindungi ank""yh...mngalahin ibu kandung sndri yg cma Diam ajj...bt aurel pa yg slah pd dya jga Manusia ciptaan Allah klau pun Dya lbh sgla yh dri yg suka nyinyiir mslh pnampilan brarti dh nasib tuuh orang g bsa sprti Aurel yg lbh baek n bgs dri yg nyinyiiir.."
1,Ibu tiri terhebat..... Ntr palingan klo dah 20an dia baru perawatan .skrg msh muda kasian klo di paksa perawatan .cm ya paling tutup mata tutup kuping skrg mah
1," <USERNAME> aurel itu cantik tau. Pernah liat asli nya kok. Org sirik itu yg menjelek jelekannya. Padahal muka sendiri belum tente lebih cantik dan muda daripada aurel. aurel difoto nampak putib bilangnya suntik putih, kelihatan hitam dibilang gk bisa ra"
1," <USERNAME> Astagfirullah... Mbak tolong ucapannya dijaga ya, ALLAH menciptakan manusia dengan sempurna, kok mbak ngomongnya kayak gitu. Aurel cantik kok, wajar manusia ada kekurangannya. Dan mbak Ashanti wajar belain anaknya, bukan caper ya mbak, sia"
1,"aurel itu perempuan hebat, ingat bgt kejadian zaman pipi mimi ny & dilihat didepan mata dia sendiri. Ga semua anak bs strong kyk dia. Yg nyinyir pasti iri krn aurel bs punya keluarga bahagia kyk skrg. Yg blg bundanya Ash lebay, mungkin blm punya anak. Hati2 sayang..km jg perempuan, nanti bakal jd ibu. Bayangin anakmu yg jd korban bully ??"
1,Ganteng... Ini klo ga salah managernya.. semoga d lancarkan yaa..
1,"Mukanya mirip ,,,insya Allah jodoh dunia akhirat mbk  <USERNAME> amiiii"
1,Cantik banggeett ya kak depe.. ???? gk keliatan loh klo dy pernah nikah.. seperti msh gadis wajah nya.. cantik ???????????? semoga lancar sampai hari H kak depe.. bahagia dunia akhirat aammiinnn ??
1,Dadddd :( Semoga bisa dateng yaaa & untuk papa-papa diluar sana. Semoga sehat selalu & bisa menjadi saksi anak-anaknya saat menikah. AAMIIN!????
1,Semoga dilancarkan nikahnya dan ayahnya lekas ditemukan dalam keadaan sehat tanpa kurang suatu apapun :)
1,Semoga aja nikahannya lancar y mb. Jgn berlarut sedih kl bapak tirinya gak datang yg penting bapak kandung datang. Mungkin sj ada alasan anak kandung dari bapak tersebut melarang. Mungkin sj bapak itu udah balikan sama istri pertamanya. Dan kl sibapak datang itu berrti akan mengingatkan cerita lama. Mungkin yaa..
1,"Yea pak polisinya pinter hahahaha.. langsung belok, SIM nembak, gatau rambu2. Malah minta surat perintah yaelah lu pikir rumah lu mau digeledah ??"
1,Ini mau nikah lagi baguass deh smoga kelak jd kluarga yg samawa
1,Lucu.... suaranya kak abbey cantik kayak orang nya.... ?????????????? terharu....
1,Pernah ketemu sama mba artika sari disesemall di Jakarta...ampunnn ayunee...mana semampai....murah senyummm....cakep pisan lah
1,"Bener kata pepatah Yess, Buah Jatuh gak Jauh dari PohoN nya... Cantik Nya dapet dari Mama_Nya, Suara Bagus dan Pinter nyanyi dari darah seni Papa Nya.. #calon generasi hebat di masa depan"
1,"Bahagianya punya anak cantik berbakat, bersyukur bnr dapat titipan demikian indah"
1,Semoga di berikan kesehatan dan rezeki yg berlimpaah pak ??
1,Semoga selalu sehat dan dimurahkan rejekinya ya Pak
1,"Pria setia, pekerja keras tdk malu pilih-pilih cari nafkah sangat sedikit sekali yang banyak kebalikan..beda bgt sama seseorang yang kenal. Mentang2 ganteng, milih nganggur ketimbang jd ojol. Udh gitu istri diselingkuhin lagi. Baik kalo ada maunya ????"
1,"Doa istri dan anak menyertaimu bang... lelaki yg bertanggung jawab itu sangat PERLU, karna kalo laki2 tanggung jawab otomatis dia akan sayang dgn anak dan istri. Beda dgn sayang yg belum tentu bertanggung jawab ??????"
1,Ya Allah bahagia itu gak harus dgn cara yg mewah sesederhana begini aj deh bahagia bisa komunikasi dgn keluarga ??
1,"Mereka hanya mencari rejeki utk keluarganya, kalau ada yg merasa tdk berkenan tolong jangan menggunakan kekerasan"
1,"Salut sekali Banting tulang demi menghidupi keluarga.yg duduk di bangku empuk,pakai AC Malah merampok.yg milih rakyat jelata lagi"
1,"Amin, smg selalu di lancarkan n di mudahkan rejeki nya.. jd inget waktu suami sy jg gojek dulu, srg nlp nanyain anak istri nya udah mkn atau blm.. pdhl mgkn dia sendiri entah sempet mkn atau ngga, walaupun hujan2an n panas2an tp ga penh mengeluh.. selalu menyempatkan komunikasi n ttp keep in touch di sela2 kesibukannya. Bangga n ttp berjuang y ms gojek krn anak n istri selalu mendoakan yg terbaik.."
1,"Respect dengan istri n anak2 nya yg menunggu dengan sabar dirumah insya Allah ,Allah swt selalu menjaga nya."
1,"Laki-laki yang beneran berjuang unt anak istri, membahagiakan istri insyaallah di dunia mendapat rejeki yg ga disangka-sangka di akherat akan ada surga kelak amiin"
1,"Bangga sama suami yg selalu ingat istri disela waktunya, apapun profesimu... Kaulah juaranya. Sehat terus pak gojek, semoga lacar rejekimu. Amiiin...."
1,Apaoun pekerjaannya yg penting halal u tuk menafkahi keluarga ... Semangat pak
1,Gojek itu mayoritas pegangguran yang lama gak kerja trus hampir putus asaa tapi tibatiba ada lapangan pekerjaan yang gak harus pake ijasah terakhir.. ini sungguh lapangan kerja yang sangat membantu sekali menurut saya ??
